{
  "title": "철강 산업 탈탄소화 동향 조사",
  "report_type": "완료보고서",
  "subtitle": "CCUS 및 그린스틸 전환 전략 분석",
  "date": "2026. 6. 11",
  "org": "POSCO IH",
  "foreword": {
    "recipient": "㈜포스코 생산기술전략실 귀중",
    "title": "철강 산업 탈탄소화 동향 조사",
    "body": "본 보고서는 포스코(이하 \"회사\")에서 발주한 \"철강 산업 탈탄소화 동향 조사\"에 대한 최종 용역 완료보고서입니다.\n전 세계 철강사들의 탄소중립 대응이 가속화됨에 따라, 주요 경쟁사의 CCUS·수소환원 전략과 시장 전망을 종합적으로 분석하였습니다.\n조사 결과가 회사의 탈탄소 전략 수립에 기여하기를 기대합니다.",
    "source": "내부 검토"
  },
  "toc": [
    "조사 개요 및 배경",
    "주요 철강사 탈탄소 동향",
    "CCUS 기술·비용 전망",
    "종합 및 시사점"
  ],
  "sections": [
    { "divider": "Ⅰ. 조사 개요 및 배경" },
    {
      "section_title": "Ⅰ. 조사 개요 및 배경",
      "head": "철강 탈탄소는 규제·시장 압력으로 선택이 아닌 필수가 되었음",
      "subtitle": "조사 배경",
      "body": [
        "EU CBAM 본격 시행으로 탄소비용이 수출 경쟁력에 직접 영향",
        "글로벌 그린스틸 수요가 2030년까지 연 20% 이상 성장 전망",
        "주요 경쟁사들이 수소환원·CCUS 투자를 빠르게 확대 중"
      ],
      "source": "BNEF (2026), Wood Mackenzie (2026)"
    },
    { "divider": "Ⅱ. 주요 철강사 탈탄소 동향" },
    {
      "section_title": "Ⅱ. 주요 철강사 탈탄소 동향",
      "head": "선도 철강사는 수소환원 중심, 후발사는 CCUS 병행 전략을 취함",
      "subtitle": "경로별 비교",
      "columns": [
        [
          "수소환원제철(H2-DRI) 중심 전환",
          "재생에너지 기반 그린수소 확보가 관건",
          "대규모 설비 투자·장기 리드타임 필요"
        ],
        [
          "기존 고로 + CCUS 병행으로 단계적 감축",
          "포집 비용·저장 인프라가 경제성 좌우",
          "상대적으로 빠른 적용 가능"
        ]
      ],
      "col_titles": ["수소환원 경로", "CCUS 경로"],
      "source": "ArcelorMittal, BNEF Steel CCUS update (2024)"
    },
    {
      "section_title": "Ⅲ. CCUS 기술·비용 전망",
      "head": "CCUS 포집비용은 2030년까지 30% 이상 하락이 전망됨",
      "subtitle": "비용 전망",
      "body": [
        "현재 톤당 포집비용은 기술별로 큰 편차 존재",
        "규모 확대와 학습효과로 단가 지속 하락 예상",
        "탄소가격 상승과 맞물려 경제성 분기점 도달"
      ],
      "table": {
        "headers": ["구분", "2026", "2030(E)"],
        "rows": [
          ["포집비용($/t)", "85", "58"],
          ["탄소가격($/t)", "70", "110"],
          ["경제성", "미달", "확보"]
        ]
      },
      "source": "Wood Mackenzie CCUS SPO (2026)"
    },
    { "divider": "Ⅳ. 종합 및 시사점" },
    {
      "section_title": "Ⅳ. 종합 및 시사점",
      "head": "단기 CCUS·중장기 수소환원의 투트랙 전략이 합리적임",
      "body": [
        "단기: 기존 설비에 CCUS를 적용해 규제 리스크 우선 완화",
        "중장기: 그린수소 확보와 연계한 수소환원 전환 추진",
        "정책·탄소가격 변화를 지속 모니터링하며 투자 시점 조정"
      ],
      "source": "종합 분석"
    }
  ]
}
